{
  "$ref": "#/definitions/tools",
  "definitions": {
    "tools": {
      "type": "object",
      "properties": {
        "name": {
          "type": "string"
        },
        "description": {
          "type": "string"
        },
        "price": {
          "type": "object",
          "properties": {
            "daily": {
              "type": "number"
            },
            "weekly": {
              "type": "number"
            }
          },
          "required": [
            "daily",
            "weekly"
          ],
          "additionalProperties": false
        },
        "image": {
          "type": "string",
          "format": "uri"
        },
        "tags": {
          "type": "array",
          "items": {
            "type": "string"
          }
        },
        "manufacturer": {
          "type": "string"
        },
        "model": {
          "type": "string"
        },
        "batteryType": {
          "type": "string"
        },
        "$schema": {
          "type": "string"
        }
      },
      "required": [
        "name",
        "description",
        "price",
        "image",
        "tags",
        "manufacturer",
        "model"
      ],
      "additionalProperties": false
    }
  },
  "$schema": "http://json-schema.org/draft-07/schema#"
}